{
  "employeeName": "ELIZABETH A DARLING",
  "employeeSSN": "XXX-XX-1234",
  "employerName": "UNIVERSITY OF PITTSBURGH",
  "employerEIN": "XX-XXX5591",
  "box1Wages": 44629.35,
  "box2FederalIncomeTax": 7631.62,
  "box3SocialSecurityWages": 48736.35,
  "box4SocialSecurityTax": 3021.65,
  "box5MedicareWages": 48736.35,
  "box6MedicareTax": 706.68,
  "box10DependentCareBenefits": 1000.0,
  "box12": [
    {
      "code": "E",
      "amount": 4107.0
    },
    {
      "code": "W",
      "amount": 1500.0
    }
  ],
  "box14": [
    {
      "label": "14H",
      "amount": 1600.0
    },
    {
      "label": "14X",
      "amount": 52.0
    }
  ],
  "state": "PA",
  "stateEmployerId": "XXXX5369",
  "box16StateWages": 47808.35,
  "box17StateIncomeTax": 1467.72,
  "box18LocalWages": 47808.35,
  "box19LocalIncomeTax": 478.08,
  "box20LocalityName": "700102"
}